['glass shelves on a display with tags on items .'; 'a glass case with shelves and various items displayed .'; 'a glass shelf with a clock ; flask ; wooden box and various other objects .'; 'a glass display case contains wooden boxes and trinkets like flasks and pocket knives .'; 'relics are positioned on glass shelves with a digital piece .'],a fire hydrant that some buildings parked buildings street,416569,9.942659075715216
['two women walking down the street holding umbrellas .'; 'view from behind of two women under umbrellas'; 'two people in dresses walking with umbrellas and bags .'; 'the back of two women holding up umbrellas and carrying bags .'; 'two people are walking away from the camera with umbrellas .'],a man wearing a mobile bear in a red that reads `` love '' '' '' '',173500,5.88235294117647
['two laptop computers sit side by side on a desk .'; 'a desk with two laptops on it by a thermos'; 'two laptops sitting side by side with their tops open .'; 'two open laptop computers sitting on top of a table .'; 'two laptops side by side on a green table .'],a window , is the track tracks the station,454982,9.942659075715216
['a coffee cup with a lid on a table next to a keyboard .'; 'a coffee cup resting on a table near a keyboard .'; 'a coffee cup that is in front of a keyboard .'; 'a coffee cup is sitting on a desk in front of a keyboard .'; 'a coffee cup sitting on a computer desk in front of a keyboard .'],the white toilet and toilet and a sink,280688,8.591115984887153
['a couple bags of luggage that are on the ground .'; 'four different eras of luggage are tossed along a rail .'; 'four different types of carrying cases in various colors .'; 'four pieces of luggage sit on the ground .'; 'a pile of luggage sitting on the ground at an airport .'],a person is a a pair phone with to a laptop,485343,9.09090909090909
['a model of a group of cars traveling into a tunnel .'; 'a model train set complete with a road and cars .'; 'a very nice large model train on a realistic set .'; 'a model of a train traveling over a bridge with cars passing under neath .'; 'a model train with cars on road and trees .'],a man is sitting in in the garage,130528,9.735009788392563
